{
    "id": "article",
    "name": "Article",
    "description": "Short-form article project type with drafts and references.",
    "folders": [
        { "name": "Workspace", "special": true },
        { "name": "Drafts" },
        { "name": "References" },
        { "name": "Assets" }
    ],
    "defaultResources": [
        {
            "folder": "Workspace",
            "name": "Article Outline",
            "type": "text",
            "template": "# Headline\n\n- Intro\n- Points\n- Conclusion\n"
        }
    ]
}
